{
  "case_id": "case_010_english_message_ukrainian_reply",
  "target": "screening",
  "dataset_version": "v1",
  "segment": "language_variant",
  "locale": "en",
  "input": {
    "history": [],
    "current_profile": {},
    "user_message": "Hi! My name is David, I live in Kyiv and I'm looking for a job as a translator."
  },
  "expected_facts": {
    "name": "David",
    "city": "Київ",
    "desired_role": "перекладач"
  },
  "expected_constraints": [],
  "expected_evidence": [],
  "acceptable_outputs": [
    "reply_to_user is written in Ukrainian despite the candidate's message being in English",
    "extracted facts are the same as they would be had the message been written in Ukrainian"
  ],
  "unacceptable_outputs": [
    "reply_to_user is written in English",
    "the language switch causes a fact to be missed or misextracted"
  ],
  "required_claims": [],
  "forbidden_claims": [],
  "reviewer_notes": "Directly tests the system prompt rule: 'Always write reply_to_user in Ukrainian ... unless the candidate has explicitly asked you to switch.' The candidate wrote in English but did not request an English reply, so Ukrainian is still required. Not yet reviewed -- demonstrates the format only (Sprint 0 Part 5).",
  "methodology_version": "pre-taxonomy-legacy",
  "prompt_version": "legacy-screening-v1",
  "provenance": {
    "type": "synthetic",
    "notes": "Invented for Sprint 0 Part 5 golden-dataset structure demonstration; no real candidate involved."
  },
  "created_at": "2026-08-25",
  "reviewed_by": { "role": null },
  "status": "draft"
}
