{
  "case_id": "case_001_straightforward_coherent_evidence",
  "target": "evidence_extraction",
  "dataset_version": "v1",
  "segment": "first_career_18_24",
  "locale": "uk",
  "input": {
    "question_prompt": "key_skills_or_interests",
    "raw_answer_text": "Я люблю організовувати заходи для друзів та координувати людей на роботі."
  },
  "expected_facts": {},
  "expected_constraints": [],
  "expected_evidence": [
    { "evidence_type": "enjoys_coordination", "normalized_text": "Enjoys organizing events and coordinating people" }
  ],
  "acceptable_outputs": [
    "extracts organizing/coordinating as its own distinct evidence item, phrased as a neutral observation",
    "confidence reflects that the statement is clear and direct, not artificially inflated or deflated"
  ],
  "unacceptable_outputs": [
    "invents an unrelated trait or skill not stated in the text (e.g. 'good at public speaking')",
    "produces zero evidence items despite a clear, unambiguous signal being present",
    "phrases the observation as a personality diagnosis (e.g. 'is an extrovert') rather than a neutral fact"
  ],
  "required_claims": [],
  "forbidden_claims": [],
  "reviewer_notes": "Baseline happy-path case for the Evidence Extractor -- a single clear signal in a short answer. Demonstrates the format only (Stage 2), not yet reviewed.",
  "methodology_version": "potential_dimensions:v1",
  "prompt_version": "evidence-extraction-v1",
  "provenance": { "type": "synthetic", "notes": "Invented for Stage 2 golden-dataset coverage; no real candidate involved." },
  "created_at": "2026-08-26",
  "reviewed_by": { "role": null },
  "status": "draft"
}
