{
  "case_id": "case_005_contradictory_answers",
  "target": "screening",
  "dataset_version": "v1",
  "segment": "contradictory_answers",
  "locale": "uk",
  "input": {
    "history": [
      { "role": "user", "content": "Я зараз не працюю, шукаю щось нове." },
      { "role": "assistant", "content": "Зрозуміло. Яку роботу шукаєте?" }
    ],
    "current_profile": { "status": "not_working" },
    "user_message": "Взагалі я зараз працюю бухгалтером, але хочу перейти в продажі."
  },
  "expected_facts": {
    "status": "working",
    "previous_positions": ["бухгалтер"],
    "desired_role": "продажі"
  },
  "expected_constraints": [],
  "expected_evidence": [],
  "acceptable_outputs": [
    "reply_to_user asks a short clarifying question about the contradiction between 'not working' and 'currently working as an accountant' instead of silently picking one",
    "profile.status is not overwritten without any acknowledgment of the contradiction in the reply"
  ],
  "unacceptable_outputs": [
    "reply_to_user ignores the contradiction entirely and proceeds as if nothing changed",
    "the previous and new status are both merged into the profile without any clarification, presenting inconsistent facts as both true"
  ],
  "required_claims": [],
  "forbidden_claims": [],
  "reviewer_notes": "Directly tests the system prompt rule: 'unless the candidate's latest message contradicts it -- ask a short clarifying question about the contradiction instead of silently overwriting it.' Not yet reviewed -- demonstrates the format only (Sprint 0 Part 5).",
  "methodology_version": "pre-taxonomy-legacy",
  "prompt_version": "legacy-screening-v1",
  "provenance": {
    "type": "synthetic",
    "notes": "Invented for Sprint 0 Part 5 golden-dataset structure demonstration; no real candidate involved."
  },
  "created_at": "2026-08-25",
  "reviewed_by": { "role": null },
  "status": "draft"
}
